{"schema":"ai-sdlc-host-adapter/v1","id":"full-host","version":"1.0.0","host":"conformance-full","harness_api":{"min":"1.0.0","max_exclusive":"2.0.0"},"capabilities":["filesystem.read","task.execute","user.prompt"],"operations":[{"portable":"approval.request","host_operation":"host.approval","semantics":"equivalent"},{"portable":"hook.lifecycle","host_operation":"host.hook","semantics":"equivalent"},{"portable":"task.execute","host_operation":"host.task","semantics":"equivalent"},{"portable":"task.parallel","host_operation":"host.parallel","semantics":"equivalent"}],"limits":{"max_concurrency":8,"isolation":true}}
