{"schema":"ai-sdlc-host-adapter/v1","id":"sequential-host","version":"1.0.0","host":"conformance-sequential","harness_api":{"min":"1.0.0","max_exclusive":"2.0.0"},"capabilities":["filesystem.read","task.execute","user.prompt"],"operations":[{"portable":"task.execute","host_operation":"host.task","semantics":"equivalent"},{"portable":"user.prompt","host_operation":"host.prompt","semantics":"equivalent"}],"limits":{"max_concurrency":1,"isolation":false}}
